Klahr	"Nobody wanted to upset the industry," said David [MASK], who from 2007 to 2016 held several management posts at the 
Apple	[MASK] employs 43,000 people in the United States and 20,000 overseas, a small fraction of the over 400,000 American workers at General Motors in the 1950s
Bernstein	an example of why it's so hard to create middle-class jobs in the U.S. now," said Jared [MASK], who until last year was an economic adviser to the White House.
iPhone	One former executive described how the company relied upon a Chinese factory to revamp [MASK] manufacturing just weeks before the device was due on shelves.
Rudolph	The snow burst through the treees with no warning but a last-second whoosh of sound, a two-story wall of white and Chris [MASK]'s piercing cry: "Avalanch! Elyse!"
Fieri	[MASK], have you eaten at your new restaurant in Times Square
Guy	Have you pulled up one of the 500 seats at [MASK]'s American Kitchen & Bar and ordered a meal?
Creekstone	When you saw the burger described as "Guy's Pat LaFrieda custom blend, all-natural [MASK] Farm Black Angus Patty
California	At your five Johnny Garlic's restaurants in [MASK], if servers arrive with main courses and find that the appetizers haven't been cleared yet, do they try to find space for the new plates next to the dirty ones?
Vegas	Did you finish that blue drink? Oh, and we never got our [MASK] fries; would you mind telling the kitchen that we don't need them?
Gaza	The 10 gunmen from [MASK] knew exactly how to find the Israeli intelligence hub - and how to get inside.
Eiffel	I breathe to the right one last time before doing a flip turn, and there it is: the [MASK] Tower rising so close I can count its metal crosses.
Paris	The pool windows offer an unobstructed, third-story view. Swimming in [MASK] is a full-on cultural experience.
Butte-aux-Cailles	Backstroking beneath the buttresses stretching across the vaulted ceiling of the 99-year-old [MASK] pool feels like backstroking through a cathedral.
Paris	But after a year of swimming in [MASK], it’s the smaller cultural insights I’ve gleaned that I find most precious:
Canadian	I pulled on a wet suit and swam in a [MASK] lake throughout the coronavirus pandemic when the pools were closed, to maintain my sanity.
Ozsoy	She underwent two surgeries, her body so violently battered that she was under constant watch for fear that her traumatized arteries would fail her. On Thursday, Ms. [MASK] remained partially paralyzed, but was gathering strength, testing her remaining mobility and cognizant of everything that had happened to her since early Sunday morning
Rutledge	Despite his instinct to marvel at the Long Island refuge, Mr. [MASK], who lives in Ridgewood, Queens, isn’t going out to the Hamptons this summer.